{
  "schemaVersion": 1,
  "kind": "secret-scan-fixtures",
  "scannerPolicyVersion": "secret-scan-policy/v1",
  "candidateTree": "9737a849bfe008204f80b88942b6cbfd340b9409",
  "fixtures": [
    {
      "id": "ltfx-w1cl01c-01",
      "path": ".ide-development/tests/test_gate_receipts.py",
      "line": 154,
      "field": "linktrend_gitops_app_token",
      "rule": "assignment.secret",
      "digest": "sha256:0479daea9d4242ebc61308de8e8bac718c503f7e38467bf626e1686b3a9087c7",
      "bytes": "ltfx.gate.must_not_be_read.v1",
      "purpose": "W1-CL-01C declare managed-core synthetic ltfx fixture without approving realistic credentials",
      "production": false
    },
    {
      "id": "ltfx-w1cl01c-02",
      "path": ".ide-development/tests/test_phase_packager_coordinator.py",
      "line": 466,
      "field": "automation_token",
      "rule": "assignment.secret",
      "digest": "sha256:8da37d76b1e760be8ad8f8b689ce950f71605de3ca48dffbc9fe277441864cc7",
      "bytes": "ltfx.coordinator.auto_token.v1",
      "purpose": "W1-CL-01C declare managed-core synthetic ltfx fixture without approving realistic credentials",
      "production": false
    },
    {
      "id": "ltfx-w1cl01c-03",
      "path": ".ide-development/tests/test_phase_packager_coordinator.py",
      "line": 467,
      "field": "user_token",
      "rule": "assignment.secret",
      "digest": "sha256:77cc2cd54f527d78b9e87f0d319284e99f81a60e7a12e8f1ea11ee351fc94aa6",
      "bytes": "ltfx.coordinator.user_token.v1",
      "purpose": "W1-CL-01C declare managed-core synthetic ltfx fixture without approving realistic credentials",
      "production": false
    },
    {
      "id": "ltfx-w202-01",
      "path": "tests/security/test_authorization_adversarial.py",
      "line": 21,
      "field": "password",
      "rule": "assignment.secret",
      "digest": "sha256:26d2714547dd65fe3af9641472db9716d867496f25fadafc99c17edae5793c82",
      "bytes": "ltfx.w2_02.bootstrap.v1",
      "purpose": "W2-02 approved synthetic security fixture",
      "production": false
    },
    {
      "id": "ltfx-w202-02",
      "path": "tests/security/test_authorization_adversarial.py",
      "line": 24,
      "field": "password",
      "rule": "assignment.secret",
      "digest": "sha256:26d2714547dd65fe3af9641472db9716d867496f25fadafc99c17edae5793c82",
      "bytes": "ltfx.w2_02.bootstrap.v1",
      "purpose": "W2-02 approved synthetic security fixture",
      "production": false
    },
    {
      "id": "ltfx-w202-03",
      "path": "tests/security/test_authorization_adversarial.py",
      "line": 34,
      "field": "reauth_password",
      "rule": "assignment.secret",
      "digest": "sha256:26d2714547dd65fe3af9641472db9716d867496f25fadafc99c17edae5793c82",
      "bytes": "ltfx.w2_02.bootstrap.v1",
      "purpose": "W2-02 approved synthetic security fixture",
      "production": false
    },
    {
      "id": "ltfx-w202-04",
      "path": "tests/security/test_authorization_adversarial.py",
      "line": 47,
      "field": "reauth_password",
      "rule": "assignment.secret",
      "digest": "sha256:94cedf0ed8c9d8d14a6103a98971fb1c2e38e598ee315cc73ca5ed421bec49fb",
      "bytes": "ltfx.w2_02.bootstrap-new.v1",
      "purpose": "W2-02 approved synthetic security fixture",
      "production": false
    },
    {
      "id": "ltfx-w202-05",
      "path": "tests/security/test_sessions_csrf.py",
      "line": 120,
      "field": "password",
      "rule": "assignment.secret",
      "digest": "sha256:9a722847a41d8150b4d460890e1b51ba3c2624b43d660279d9d8b271c5b89f2f",
      "bytes": "ltfx.w2_02.correct.v1",
      "purpose": "W2-02 approved synthetic security fixture",
      "production": false
    },
    {
      "id": "ltfx-w202-06",
      "path": "tests/security/test_sessions_csrf.py",
      "line": 125,
      "field": "password",
      "rule": "assignment.secret",
      "digest": "sha256:9a722847a41d8150b4d460890e1b51ba3c2624b43d660279d9d8b271c5b89f2f",
      "bytes": "ltfx.w2_02.correct.v1",
      "purpose": "W2-02 approved synthetic security fixture",
      "production": false
    },
    {
      "id": "ltfx-w204-01",
      "path": "tests/control_centre/test_w2_04_control_centre.py",
      "line": 210,
      "field": "password",
      "rule": "assignment.secret",
      "digest": "sha256:814ef35bf7edb51bad04e2d9cb169629f995077cb920c1b460dded269bc909bc",
      "bytes": "ltfx.w2_04.redaction.v1",
      "purpose": "W2-04 approved synthetic observability redaction fixture",
      "production": false
    },
    {
      "id": "ltfx-w204-02",
      "path": "tests/control_centre/test_w2_04_control_centre.py",
      "line": 211,
      "field": "cookie",
      "rule": "assignment.secret",
      "digest": "sha256:2c5f6823628cbf28836d84be5eede618853713efca0e31c9dde4941527af2c0e",
      "bytes": "ltfx.w2_04.cookie.v1",
      "purpose": "W2-04 approved synthetic observability redaction fixture",
      "production": false
    },
    {
      "id": "ltfx-w303-01",
      "path": "tests/recovery_product/test_backup_recovery.py",
      "line": 121,
      "field": "api_key",
      "rule": "assignment.secret",
      "digest": "sha256:7d6cec1e3677528d6ca36ff7a3f3f22959ae880909277571c263b2a37ab667c0",
      "purpose": "W3-03 approved synthetic secret rejection fixture",
      "production": false
    },
    {
      "id": "ltfx-w304-01",
      "path": "scripts/rehearsal/offline_rehearsal.py",
      "line": 554,
      "field": "password",
      "rule": "assignment.secret",
      "digest": "sha256:5dd17ae832ce5cf7e6adf11cca7c40aec3d30cefcfb46f38658f4a7dbc773896",
      "bytes": "ltfx.w3_04.admin.v1",
      "purpose": "W3-04 approved synthetic offline control fixture",
      "production": false
    },
    {
      "id": "ltfx-w304-02",
      "path": "scripts/rehearsal/offline_rehearsal.py",
      "line": 555,
      "field": "password",
      "rule": "assignment.secret",
      "digest": "sha256:92774ac078bdc348bf7d9b00a407d2ae63844df7a26cd7d7fe171d38cdbd01aa",
      "bytes": "ltfx.w3_04.operator.v1",
      "purpose": "W3-04 approved synthetic offline control fixture",
      "production": false
    },
    {
      "id": "ltfx-w304-03",
      "path": "scripts/rehearsal/offline_rehearsal.py",
      "line": 556,
      "field": "password",
      "rule": "assignment.secret",
      "digest": "sha256:5dd17ae832ce5cf7e6adf11cca7c40aec3d30cefcfb46f38658f4a7dbc773896",
      "bytes": "ltfx.w3_04.admin.v1",
      "purpose": "W3-04 approved synthetic offline control fixture",
      "production": false
    },
    {
      "id": "ltfx-w304-04",
      "path": "scripts/rehearsal/offline_rehearsal.py",
      "line": 557,
      "field": "password",
      "rule": "assignment.secret",
      "digest": "sha256:92774ac078bdc348bf7d9b00a407d2ae63844df7a26cd7d7fe171d38cdbd01aa",
      "bytes": "ltfx.w3_04.operator.v1",
      "purpose": "W3-04 approved synthetic offline control fixture",
      "production": false
    },
    {
      "id": "ltfx-w304-05",
      "path": "scripts/rehearsal/offline_rehearsal.py",
      "line": 585,
      "field": "password",
      "rule": "assignment.secret",
      "digest": "sha256:92774ac078bdc348bf7d9b00a407d2ae63844df7a26cd7d7fe171d38cdbd01aa",
      "bytes": "ltfx.w3_04.operator.v1",
      "purpose": "W3-04 approved synthetic offline control fixture",
      "production": false
    },
    {
      "id": "ltfx-w304-06",
      "path": "scripts/rehearsal/offline_rehearsal.py",
      "line": 600,
      "field": "password",
      "rule": "assignment.secret",
      "digest": "sha256:92774ac078bdc348bf7d9b00a407d2ae63844df7a26cd7d7fe171d38cdbd01aa",
      "bytes": "ltfx.w3_04.operator.v1",
      "purpose": "W3-04 approved synthetic offline control fixture",
      "production": false
    }
  ]
}
